Subject,Code,Description,Professor,Core ASD,Core EPD,Core ESD,Core ISTD,Term 4,Term 5,Term 6,Term 7,Term 8,Pre-requisite,Alt-requisite,Remark
Statistics,40.004,"The course provides an introduction to applied statistics and data analysis. The course will cover the following topics: collecting and exploring data, estimation and hypothesis testing, linear regression, analysis of variance and elementary methods in non-parametric statistics. Applications and examples based on engineering systems data will be given.",,0,0,1,0,0,1,0,1,0,40.001,,
Data and Business Analytics,40.011,"This course provides an introduction to the Engineering Systems and Design pillar by focusing on using industrial or commercial data to identify an opportunity for system improvement and estimating the value of this improvement to the system owner. A signature feature of the course and the primary motivation for the course material comes from a team-based, semester-long project for an external client. Students develop skills in organising industrial projects and in presenting their results in oral, written, and poster form. In addition, problems in improving system throughput and flowtime are used throughout to motivate many of the topics. Students acquire skills in data manipulation, data visualisation, data analysis, system modelling, revenue and cost estimation, financial ratio analysis, and business simulation.",,0,0,1,0,1,0,1,0,0,,,40.001 co-requiste
Manufacturing and Service Operations,40.012,"This course introduces concepts and techniques related to the design, planning, control, and improvement of both manufacturing and service systems. The course provides basic definitions of operations management terms, tools and techniques for analyzing system operations, and a strategic context for making operational decisions. In particular, the topics covered include: Manufacturing and inventory decisions for single and multi-echelon systems under deterministic and stochastic demand in the presence or absence of production/transportation lead time; trade-off between fixed cost of production and inventory holding costs; trade-off between holding and back-order/stock-out costs;stochastic modelling and queuing analysis for analyzing transient and steady-state performance of service systems; cost analysis of multi-server queues and network of queues; priority queues; risk pooling in manufacturing and service systems.",,0,0,1,0,0,1,0,1,0,40.001;40.002,,40.001 only for non ESD
Engineering Systems Architecture,40.014,"The purpose of this course is to prepare students to exercise leadership in engineering system design by focusing on the top-level conceptual design of a system. A system architecture can be viewed as a collection of the most important design decisions defining the system. Detailed design operates within the boundaries set by this system architecture. Many of the system’s ultimate qualities, including security, reliability, and resilience, are determined by the system architecture and can be modified later only at great cost. It is important therefore to evaluate these qualities at the architecture level and consider numerous alternatives. This course moves through four phases of architectural thinking, namely systems thinking, systems analysis, systems creation, and tradespace exploration. Theoretical components will be complemented by case studies, practical applications, and software implementations. Students will also conduct a term-long team design project.",,0,0,1,0,0,1,0,1,0,40.001;40.002,,40.001 only for non ESD
Simulation Modelling and Analysis,40.015,This course will introduce students to various aspects of analyzing complex systems using simulation methodologies,,0,0,1,0,1,0,1,0,0,40.001,40.004;30.003;50.034,
The Analytics Edge,40.016,"The increasing availability of data is changing the way organizations are thinking about themselves and the way they interact with the world. Data is helping improve the profits of businesses, the quality of life of individuals, the predictions on performance of sports teams and social interactions. In this course you will learn how to use data and analytics to give you an edge. The course will expose students to real world examples of how analytics is being used with examples from Moneyball, Watson and the Framingham Heart Study among others. Through these examples you will learn on how to use tools of analytics such as linear regression, logistic regression, classification and regression trees, graphical models, visualization, text analytics, clustering and optimization in practice. The statistical software R and spreadsheets will be used in the course.",,0,0,1,0,1,0,1,0,0,40.002,40.004;30.003;50.034,
Urban Transportation,01.107,"This course provides students with an understanding of current challenges and opportunities in land transportation. It introduces road vehicle propulsion technologies and transportation systems modelling, including the tools and methods to assess technologies and system performance. Topics include conventional and alternative vehicle powertrains, intelligent transportation systems (ITS), transportation network modelling, traffic simulation, and travel demand modelling. Students will complete a project on a subject of their choosing.",,0,0,0,0,0,1,0,1,0,,,
Derivative Pricing and Risk Management,40.242,"Introduction to the theory and practice of mathematical finance: basics of derivative securities; interest rate and bonds; forward and futures contracts, hedging using futures contracts; option contracts and arbitrage relationship; binomial model, no-arbitrage pricing, risk-neutral pricing, and American options pricing; Brownian motion, Black-Scholes-Merton model, delta hedging, Greek letters, implied volatility, and volatility smile; classical and advanced portfolio management and execution models and strategies.",,0,0,0,0,0,1,0,1,0,40.001;40.002;40.004;40.240,,
Advance Topics in Optimisation & Stochastic Modelling,40.302&40.305,"This course is a follow-up to the ESD core course in Optimisation that students take in Term 4. The course will cover advanced topics in optimisation with a strong focus on modelling, formulations and optimisation techniques. Students will be introduced to the basics and design of algebraic modelling languages and spreadsheet models for describing optimisation problems. The primary application on which the course will be based is scheduling. Through the application, students will be exposed to advanced topics in optimisation such as proving optimality of schedules, integer programming formulations, heuristics, deterministic and stochastic dynamic optimization frameworks.<br>This is a follow-up to the introduction course on Stochastic Modelling. Students learn advanced methods in stochastic modelling with a focus on business, engineering and financial math applications. Topics to be covered include renewal theory and martingales (discrete time). Time permitting other topics such as branching processes, spatial processes or stochastic networks could be introduced.",,0,0,0,0,0,1,0,1,0,40.001;40.012;40.002,,
Statistical and Machine Learning,40.319,"An agent is intelligent if it perceives its environment and takes actions that maximize its chances of successfully achieving its goals. In this course, we will study how to imbue machines with intelligence, focusing on foundational principles and mathematical theories of real-world modeling, problem solving and statistical learning. We will borrow strategies from biological intelligence such as neural networks and reinforcement learning. Students will learn powerful concepts from decision theory, information theory, generative models, deep learning, dimensionality reduction, expectation-maximization, time-series prediction, control theory and machine reasoning, and will exploit software tools for building intelligent systems.",,0,0,0,0,0,1,0,1,0,,40.004;30.003;50.034,
Airport Systems Modelling and Simulation,40.321,"Airports are complex systems that require the use of specialized modelling tools to be operated and managed efficiently. This course aims to provide students with appropriate knowledge and modelling skillset to critically apply simulation and optimization tools for airport systems planning, management and design. The modelling mindset is also applicable to other complex systems such as manufacturing facilities and hospitals. Topics include: airside capacity estimation, optimization of airport capacity utilization, airport demand management, simulation of airside aircraft movements, simulation of landside processes and air traffic flow management. A major aspect of this class is a final project where students are required to conduct a comprehensive simulation study on airport management using fast-time airport simulation tools (TAAM, Airtop, or CAST).",,0,0,0,0,0,1,0,1,0,40.002;40.015;40.320,,
Investment Science,40.240,"This course will focus on the financial theory of asset pricing. While this course will be broad in scope and will cover many different topics relating to finance, a particular emphasis will be placed on topics related to financial markets. The primary topics covered in the class include present value, asset valuation, expected utility, portfolio selection, and the trade-off between risk and return.",,0,0,0,0,1,0,1,0,0,40.001,,
Supply Chain Management,40.260,"Introduces concepts of supply chain design and operation. Topics include demand estimation, location and capacity planning, process analysis, inventory management, revenue management, supply chain procurement and coordination, and emerging topics in supply chains. A major aspect of the class is a student project on supply chain design.",,0,0,0,0,1,0,1,0,0,40.012,40.004;30.003;50.034,
Airport Systems Planning and Design,40.320,"An airport is one of the most complex engineering systems in existence. It must simultaneously achieve ultra-high levels of safety and security while providing high throughput of passengers and cargo on a daily basis. It is an integrated system of systems bringing together airlines, air traffic controllers, baggage and cargo handlers, airport operators, customs, immigration, and security officers, as well as various ancillary support services such as connection to ground transportation and the provision of food, beverage, and emergency services. If you can appreciate the multiple dimensions of planning and design of an airport system, you are well-prepared to tackle many other system of systems challenges.",,0,0,0,0,1,0,1,0,0,40.012;40.014,,
Game Theory,40.316,"The course will provide a consistent framework for game-theoretic concepts, some of which have already been informally presented to the students in other courses. The course will cover the basic concepts in game theory, allowing the students to use strategic models in their capstone research.",,0,0,0,0,0,0,0,0,1,40.001,40.004;30.003;50.034,
Financial Systems Design,40.317,"This is a course in computational finance in which students learn the tools for delivering financial services and the algorithms used to price complex financial instruments (derivatives). It also abstracts the design of financial services, focusing on interface design, which reduces to language design. Only moderate coding proficiency is required (Python 3) but there are weekly coding exercises. The design exercise is to propose an interactive, distributed trading game and to specify the interfaces.",,0,0,0,0,0,0,0,0,1,40.242,,
Supply Chain Digitalisation and Design,40.318,"Successful orchestration of planning and execution processes across virtual and global supply chain networks is a critical success factor for today’s businesses. This necessitates tight information integration across business functions and a strong alignment between the business and information technology functions. In the first half of the course we will study supply chain operations of a global manufacturing and distribution company, the NOVA Corporation. Using an experiential simulation of the company’s supply chain, we will identify common errors in the design of such systems. We will see in greater detail how logistics policies, organizational design, performance measurement systems, information flows, and even currency fluctuations can impact a company’s performance. Customer requirements ultimately determine a company’s manufacturing and distribution system requirements. The course material is unified around the theme of applying five basic principles of supply chain management to global manufacturing and logistics. The second half of the course develops a framework and process for discovering the value potential of digitalisation and ensuring value realization from investments in digital technologies.",,0,0,0,0,0,0,0,0,1,40.260,,
Graphics and Visualisation,50.017,"Introduction to computer graphics algorithms, software and hardware. Topics include ray tracing, the graphics pipeline, transformations, texture mapping, shadows, sampling, global illumination, splines, animation, color, fundamentals of virtual and augmented reality (VR and AR).",,0,0,0,0,0,0,0,0,1,50.003,,
Artificial Intelligence,50.021,"Artificial intelligence (AI) is a rich field spanning formal systems for representing and processing symbolic information, computational models of human cognition, and a range of techniques for learning, planning and reasoning under uncertainty. In this course, students will gain an appreciation of what “artificial intelligence” means, and how it can be usefully applied to real-world problems. Students will learn the intricacies of state-space search and constraint programming. Through an in-depth treatment of knowledge representation via propositional and first-order logic, students will understand how expert knowledge can be fed into and be processed by modern computers. In addition, students will acquire skills in using planning algorithms to find solutions to optimization problems, and understand how to use probabilistic reasoning to draw inferences in uncertain environments.",,0,0,0,0,0,0,0,0,1,,01.112;40.319,
Foundations of Game Design and Development,50.033,"This is an introductory course about the basic of game creation. This course provides an overview of different aspects of game development. Student will get in touch with C# Programming (industry standard), starting with console application, then GUI games on various platform with graphics, dialog boxes, and user control. There are also basic overview of topics including game architecture, interface design, graphics for game, audio for game, prototyping and play testing. Students will be able to implement their creative gaming idea by using the latest gaming tools which are easy and readily usable.",,0,0,0,0,0,0,0,0,1,50.001;50.004,,
Natural Language Processing,50.040,"Natural Language Processing (NLP) is an important area within the general field of artificial Intelligence (AI). Modern NLP models focus on using machine learning algorithms for solving various text processing problems. This course covers fundamental topics within the domain of NLP, including part-of-speech tagging, word embeddings, chunking, syntactic parsing, semantic role labeling, semantic parsing, named entity recognition, sentiment analysis, generation, summarization and machine translation. Students will get a chance to learn fundamental algorithms as well as state-of-the-art, deep-learning based techniques for NLP and will get a chance to implement and play with advanced NLP algorithms and models.",,0,0,0,0,0,0,0,0,1,,01.112;40.319,
System Security,50.044,"This course covers the security of users, individual computer systems, including personal computers, smart cards and embedded platforms. The course starts with considerations of common security flaws in a computer system, security of widely used computer platforms and user authentication. Then, topics such as physical‐layer attacks and tamper resistant hardware are discussed. Finally, the course ends with a set of selected security topics like biometrics, computer forensics, and Bitcoin.",,,,,0,0,0,0,0,1,50.042,,
Introduction to Information Systems & Programming,50.001,"This course is an introduction to the design and programming of information systems. Topics include object oriented programming, data structures, mobile system and programming, design pattern and use of software libraries. Sample applications include Internet of Things, Android app and data analytics.",,0,0,0,1,1,0,1,0,0,,,
Computation Structures,50.002,"This course introduces architecture of digital systems, emphasising structural principles common to a wide range of technologies. Topics include Multilevel implementation strategies; definition of new primitives (e.g., gates, instructions, procedures, and processes) and their mechanisation using lower-level elements. Analysis of potential concurrency; precedence constraints and performance measures; pipelined and multidimensional systems; instruction set design issues; architectural support for contemporary software structures.",,0,0,0,1,1,0,1,0,0,,,
Introduction to Alorithms,50.004,"This is an introductory course to mathematical modeling of computational problems, as well as common algorithms, algorithmic paradigms, and data structures used to solve these problems. It emphasizes the relationship between algorithms and programming, and introduces basic performance measures and analysis techniques for these problems.",,0,0,0,1,1,0,1,0,0,,,
Machine Learning,01.112,"Machine learning is the study of algorithms that improve their performance at some task with experience. In this course, students will learn how machine learning has led to many innovative real-world applications. The students will also gain an in-depth understanding of a broad range of machine learning algorithms from basic to state-of-the-art, such as: naïve Bayes, logistic regression, neural networks, clustering, probabilistic graphical models, reinforcement learning and SVMs.",,0,0,0,0,1,0,1,0,0,,50.034;30.003;40.004,
Networks,50.012,"This course will introduce the principles and practice of computer networking, with emphasis on the Internet. Students will learn concepts, principles, protocols, and applications of computer networks, including packet switching, layered architectures, TCP/IP, physical layer, error control, window flow control, local area networks (Ethernet, Token Ring; FDDI), network layer, congestion control, quality of service, multicast, network programming interfaces, networked applications.",,0,0,0,0,1,0,1,0,0,50.005,,
Computational Data Science,50.038,"This course provides students the necessary background and experience in data science technology and concepts. Students will gain experience with tackling a complete data science project, from data gathering and preprocessing to data analysis through machine learning tools. Students will learn to apply fundamental concepts in machine learning to data storage and distributed processing as a foundation for their project.",,0,0,0,0,1,0,1,0,0,,50.034;30.003;40.004,
Foundations of Cybersecurity,50.042,"This course provides students with a basic appreciation and understanding of the core concepts of information security. Topics to be covered include concepts for confidentiality, integrity and availability; introduction to cybercrimes and security issues; threats to information systems and devices; cryptographic primitives such as symmetric and asymmetric cryptography; core problems such as random number generation, entropy, and key distribution; and common topics such as security protocols and public‐key infrastructures.",,0,0,0,0,1,0,1,0,0,50.005,,
Database and Big Data,50.043,"This course covers the fundamentals of traditional databases, such as Oracle and MySQL, and core ideas of recent big data systems. Students will learn important problems in data management that these systems are designed to solve. They will experience with building applications on top of traditional databases, namely SQLite, and state‐of‐the‐art big data platforms, namely MongoDB and Apache Spark. These systems will be running both locally and on the Amazon cloud (Amazon Web Service). The students will be able to determine for themselves the advantages and disadvantages of different systems.",,0,0,0,0,1,0,1,0,0,50.004;50.005,,
Elements of Software Construction,50.003,"This course is an introduction to the fundamental principles and techniques of software construction that have greatest impact on practice. Topics include capturing the essence of a problem by recognizing and inventing suitable abstractions; key paradigms, including basic concepts of software design and their expression using notations from Unified Modeling Language (UML); software testing, automated software test generation, automated software security testing via blackbox, greybox and whitebox fuzzing approaches, detection and removal of software code smells, software coding standards to avoid security loopholes, concurrent programming, including programming with threads and processes, understanding concurrency problems like deadlock and data race. This course includes exercises in software design, implementation, testing and reasoning.",,0,0,0,1,0,1,0,1,0,50.001,,
Computer System Engineering,50.005,"Topics on the engineering of computing and networking systems: design challenges; techniques for controlling complexity; operating systems and networking systems: performance; strong modularity; client-server; naming; security and privacy, atomicity and coordination of concurrent activities; user and end-to-end applications. Case studies of working systems and readings from the current literature provide comparisons and contrasts. Students will complete two design/implementation projects.",,0,0,0,1,0,1,0,1,0,50.002,,
Introduction to Probability and Statistics,50.034,"This course is an introduction to statistics and probability covering essential topics. Sample space, discrete and continuous random variables, probability distributions, joint and conditional distributions, expectation, transformation of random variables, limit theorems, estimation theory, hypothesis testing, confidence interval, statistical tests, and regression.",,0,0,0,1,0,1,0,1,0,,,
User Interface Design and Implementation,50.006,"The course will introduce the field of Human-Computer Interaction (HCI), Interaction Design and Usability in the context of today’s diverse interactive products. The course will cover usability principles, design guidelines and heuristics, user-centred design, usability engineering, user experience and evaluation techniques, and will include a series of mini design exercises and design-implementation projects. Students who successfully complete the course will be well-equipped with the concepts and language to argue and discuss how well a system’s front-end (e.g. a website, a mobile app, a museum kiosk, etc.) is designed and be able to design usable, easy-to-use, intuitive, attractive user-interfaces informed by the concepts and knowledge learned during the course.",,0,0,0,0,0,1,0,1,0,,,
Network Security,50.020,"This course covers theory and practice of network security. Starting with general introduction of network security, this course focuses on Internet security. The first part addresses common security issues and countermeasures at each of the five layers from the TCP/IP protocol stack. Subsequently, Firewall and Intrusion Detection/ Prevention System are covered as two of the most common tools/technologies to protect a network. Finally, the course ends with special topics such as wireless network security, IoT security, etc.",,0,0,0,0,0,1,0,1,0,50.042,,
Computer Vision,50.035,"This is an advanced undergraduate level course on the concepts, algorithms and system design in computer vision. The particular focus in this course is on the underlying computational/mathematical principles, and data-driven and neural networks (aka “deep learning”) approaches. The course introduces different computer vision tasks such as image/video classification, localization, detection, among others, and discusses different computational algorithms for these tasks, including recently proposed deep learning methods: convolutional neural networks (CNN), recurrent neural networks (RNN), long short-term memory (LSTM), Generative Adversarial Networks (GAN), etc. Students will learn to design, implement, train and debug their own systems and neural networks, and gain understanding of, and the skills to use, cutting-edge technologies in computer vision. A semester-long, 1-D design project requires students to design, implement, and train multi-million parameter neural networks to address real-world computer vision problems.",,0,0,0,0,0,1,0,1,0,,01.112;40.319,
Blockchain Technology,50.037,"Decentralized blockchain-based systems, such as Bitcoin and Ethereum, are successful beyond all expectations. Although still in their infancy, they promise to revolutionize how we think of financial, information, and other infrastructures. This course covers the technical aspects of public distributed ledgers, blockchain systems, cryptocurrencies, and smart contracts. Students will learn how these systems are built, how to interact with them, how to design and build secure distributed applications.",,0,0,0,0,0,1,0,1,0,,,
