Subject,Code,Description,Professor,Core ASD,Core EPD,Core ESD,Core ISTD,Term 4,Term 5,Term 6,Term 7,Term 8,Pre-requisite,Alt-requisite,Remark
Structures & Materials,30.001,"This course introduces students to statics and the mechanics of rigid bodies. Emphasis will be on the three basic principles of equilibrium, geometric compatibility, and material behavior. The course covers the topics related to the mechanics of materials. Mechanical properties of rigid and deformable bodies; analysis and design of beams and members of structures subjected to tension, compression, torsion, bending and combined stresses. Introduction to mechanical behavior of engineering materials, and the use of materials in mechanical design.",Wu Ping; Arief Budiman; Soh Gim Song,0,1,0,0,1,0,1,0,0,,,
Circuits & Electronics,30.002,"The SUTD EPD pillar course, Circuits and Electronics, introduces the fundamentals of the lumped circuit abstraction. Topics include: resistive elements and networks; independent and dependent sources; switches and MOS transistors; digital abstraction; operational amplifiers; energy storage elements; dynamics of first and second order networks; design in the time and frequency domains; analog and digital circuits and applications. Design and lab exercises are significant components of the course.",Zhao Rong; Lee Chee Huei; Joel Yang,0,1,0,0,1,0,1,0,0,,,
Introduction To Probability & Statistics,30.003,"An introduction to statistics and probability covering essential topics. Sample space, discrete and continuous random variables, probability distributions, joint and conditional distributions, expectation, transformation of random variables, limit theorems, estimation theory, hypothesis testing, confidence interval, statistical tests, and regression.",Chen Lujie; Wu Chunfeng,0,1,0,0,1,0,1,0,0,,,
Engineering Design Innovation,30.007,"Students develop a holistic view and competency in the combined interactions of engineering design and engineering project management. Working in small teams, students carry out a design project targeting practical and functional devices. Students learn design, analysis, prototyping, testing, and project management methods to e??€ectively plan, organize, and execute an engineering project. Emphasis is placed on creativity, innovation, and the use of engineering analysis to reduce errors and iterations in the design process.",Pablo Valdivia y Alvarado; Subburaj Karupppasamy,0,1,0,0,0,1,0,1,0,,,
Systems & Control,30.101,"This course will provide students with the framework to understand, and the methods to model, analyze and design physical and engineering control systems. The topics include: Lumped parameter mathematical modelling and analysis of continuous time systems and signals in various disciplines using state-space and transfer function approaches and the Laplace transform. Analysis of linear time-invariant (LTI) systems and signals in time and frequency domains for synthesis and design of automatic feedback controllers.",Foong Shaohui; Roland Bouffanais,0,1,0,0,0,1,0,1,0,30.001,,
Electromagnetics & Applications,30.102,"This course focuses on electromagnetics (EM, Maxwell equations), the theories and applications. It includes: Transmission line theory and circuit concepts of EM waves, Resonators and waveguides, Antennas, Plane waves, Waves in different media and boundaries. The hands-on sections cover Matlab programming and commercial EM software (CST microwave studio). 1D project this year is wireless power transfer. 2D project is to apply EM to solve problems related to another discipline. The content from Physics 2 (10.005) will be recapped.",Huang Shaoying,0,0,0,0,0,1,0,1,0,,,
Fluid Mechanics,30.103,"This course will provide students with an introduction to the fundamental principles upon which an understanding and working knowledge of the behavior of fluids can be built. The course will familiarize students with important environmental and engineering challenges associated with fluid dynamics and introduce key elements for the study of fluid mechanics: properties of fluids, hydrostatics, equations of motion, control volume analysis, inviscid and viscous flows and dimensional analysis with the role of the Reynolds number. Many engineering designs require the application of fluid dynamic principles. The course will emphasize the role of fluid mechanics in design through examples in class, computational fluid dynamics (CFD) project and 2D project.",Michinao Hashimoto; Roland Bouffanais,0,0,0,0,0,1,0,1,0,,,
Dynamics,30.104,"This course, particularly relevant for Mechanical, Aerospace and Robotics engineers, focuses on the dynamics of mechanical systems. The topics studied include: kinematics, force-momentum formulation for systems of particles and rigid bodies, work-energy concepts, virtual displacements and virtual work, Lagrange?€?s equations for systems of particles and rigid bodies, linearization of equations of motion, linear stability analysis, free and forced vibration of linear multi-degree of freedom models of mechanical systems. Emphasis is dedicated to the connection of these topics to realistic engineering problems thanks to ?€?hands-on?€? and numerical design projects.",Dario Poletti,0,0,0,0,1,0,1,0,0,,,
Machine Element Design,30.105,"This subject provides advanced knowledge for designing key machine elements and mechanisms such as bearing, shafts, gears, and springs. It also provides analytical, heuristic and case-based knowledge to make machines as integrated systems of machine elements. Emphasis is on use of core engineering knowledge, including mechanics and materials, along with design principles to ensure the machine elements remain within operational limits while yet providing the necessary system level machine requirements. Students will work in small groups to analyze and size machine elements.",Soh Gim Song,0,0,0,0,1,0,1,0,0,30.001,,
Microelectronics Circuits and Devices,30.106,"Introduction to: 1. fundamental concepts in semiconductor physics, operations of key microelectronic devices, such as diodes, BJTs and MOSFETs). 2. small signal analysis technique to understand the microelectronic circuits using microelectronic devices, such as single stage amplifier, differential amplifier, multi-stage amplifier. 3. large signal analysis technique to understand the logic circuits using microelectronic devices, such as CMOS inverter.",Cheah Chin Wei,0,0,0,0,1,0,1,0,0,30.002,,
Power Electronics,30.107,"The SUTD EPD pillar course, Power Electronics 30.107 addresses the application of electronics to energy conversion and control. Topics covered include: characteristics of power semiconductor devices; modeling, analysis, and control techniques; design of power circuits including ac-ac regulator, inverters, rectifiers, and dc-dc converters; analysis and design of magnetic components and filters; interface between power electronics equipment and utility supply; and application to power supplies, motor drives, and green energy sources.",Teo Tee Hui,0,0,0,0,1,0,1,0,0,30.002,,
Material Science,30.108,"Fundamentals of structure and energetics that underpin materials science. Structure descriptors for crystalline and non-crystalline states. The relationship between structure, processing, performance and properties of materials. Materials selection for sustainable product design and to meet engineering requirements.",Tan Mei Chee,0,0,0,0,1,0,1,0,0,30.001,,
Thermal Systems for Power & Environment,30.109,"This course aims to extend the fundamental concepts of thermodynamics from that covered in Engineering in The Physical World to include phase-change processes, transient systems and the concept of useful work and irreversibility. This course also focuses on fundamental heat transfer processes such as steady state and transient conduction, forced and natural convection systems. These fundamental concepts are then applied to the design of processes and equipment.",Massimiliano Colla; Apple Koh,0,0,0,0,1,0,1,0,0,,,
Digital Systems Laboratory,30.110,"Lectures and labs are conducted on digital logic, flip flops, FPGAs, counters, and finite state machines. The subject prepares students for the design and implementation of a final project of their choice: games, music, digital filters, wireless communications, video, or graphics. It requires extensive use of Verilog to describe and implement digital system designs. Students engage in a group-based lab and project.",Yuen Chau,0,0,0,0,1,0,1,0,0,30.002,,
Entrepreneurship,30.111,"This course focuses on the social-technical factors and forces that affect the startup process, and the scientific principles underpinning the integrated product-process-people decisions under extreme uncertainty. In 30.111, students are expected to start up a new venture based on their design projects for experiential learning. In the past few years, Kickstarter campaigns have been used as the medium of the startup projects. Lectures, studio sessions, guest panel sharing sessions and readings aid experiential learning. 30.111 is supported by an ?€?ecosystem?€? of entrepreneurs, venture capitalists, and designers.",Jianxi Luo,0,0,0,0,1,0,1,0,0,,,
Topics in Biomedical and Healthcare Engineering,30.203,"This course will introduce students to the broad discipline of biomedical engineering, and the fundamental life science and engineering principles associated with biomedical systems and healthcare delivery. The course focuses on three key application areas of biomedical implants, instrumentation, and diagnostics, and will familiarize students with the theoretical and practical considerations relevant to the design and development of biomedical devices, tools, and systems in these areas.",Xiaojuan Khoo,0,0,0,0,1,0,1,0,0,30.001,,
Digital Biomimetics: Sustainable Materials and Manufacturing,30.316,"The course is a cross-disciplinary collaboration between Architecture and Sustainable Design and Engineering Product Development. It brings together material science and digital fabrication, fusing natural composites with industrial robotics, aiming to produce innovation in the realm of sustainable design and manufacturing. It suggests that designs inspired by biological processes found in nature, may assist in transforming society toward a more environmentally benign mode of production from the ground up. This process starts from the understanding of the principles behind structural biological systems and the development of tools embracing the paradigm imposed by nature instead of those predefined by the existing manufacturing technologies. As a research and design course, students are required to develop their own proposals, methods and artifact which may lead to publication of results in journals and conferences.",Javier G. Fernandez; Stylianos Dritsas (ASD),0,0,0,0,1,0,1,0,0,30.001;30.007,,
Design and Fabrication of Microelectromechanical Systems (MEMS),30.113,"This course introduces design and fabrication of MEMS, including topics of material properties, micro-fabrication technologies, and basic principles of MEMS sensors and actuators, and applications. The first half term covers basic microfabrication techniques and process flow, MEMS materials and their properties, structural behavior and packaging. The second half term covers different sensing and actuating working principles (i.e. electrostatic, piezoelectric, piezoresistive, thermalcapacitive, microfluidics, etc.), design and analysis. A variety of MEMS device are analyzed including inertial sensors, pressure sensors, gyroscope, optical MEMS, and bioMEMS. In addition, throughout the course, a number of real-world applications are introduced and discussed. Hands-on lab sessions in cleanroom are significant components.",Tan Mei Chee,0,0,0,0,0,1,0,1,0,30.001;30.002,,
Advanced Feedback and Control,30.114,"Extending feedback control theory and applications (from 30.101 Systems & Control) to include multi-input & multi-output and discrete-time systems. Mathematical modeling and analysis of discrete time systems in various disciplines using state-space, pulse transfer function and z-transform. Relating controllability and observability and their canonical forms to synthesize and design advanced continuous and discrete-time controllers. Introduction of pole-placement based controller design and formulation of state observers.",Foong Shaohui,0,0,0,0,0,1,0,1,0,30.101,,
Digital Signal Processing,30.115,The aims of this course are to teach the students with digital signal principles and processing techniques. This course serves as a strong fundamental for digital signal processing with projects experience in audio processing and image processing.,Cai Kui,0,0,0,0,0,1,0,1,0,,,
Introduction to Nano-electronics,30.116,"Traditionally, progress in electronics has been driven by miniaturisation. When the dimension goes to nano-meter or the quantum materials were used, the traditional model of the electronics must be revised. As an introduction to nano-electronics, this class teaches the theory of current, voltage and resistance from bottom up. To describe physics at the nanoscale, we will begin with an introduction to the principles of quantum mechanics: including quantisation, the wave-particle duality, wave functions, Schr??dinger?€?s equation, and electronic properties on nano-materials. We will then compare the traditional MOSFETs with nano-scale transistors.",Ricky Ang,0,0,0,0,0,1,0,1,0,30.002,,
Optical Engineering & Communications,30.118,"This is an introductory optics course that will cover the theory and design principles of optics and photonics with an emphasis on applications. Optical communication systems, lightwave system components, multichannel systems, fiber optics will be covered",Dawn Tan,0,0,0,0,0,1,0,1,0,30.002;30.101,,
Healthcare Product Design,30.123,"This project-based design course aims to teach the students in developing fundamentals of the design aspects of biomedical and healthcare devices and diagnostics. The course has been designed to educate students to solve real-life clinical problems using their engineering knowledge by designing and developing biomedical products that can be ranging from devices, in-vitro diagnostic kits, and instruments.",Subburaj Karupppasamy,0,0,0,0,0,1,0,1,0,30.007;30.001;30.002;30.101,,
Electric Power Systems Analysis and Design,30.117,"This is a course in electric power systems. Topics include: overview of electric transmission and distribution networks; ac transmission lines and cable systems; fundamental principles of major power system components ?€? generators, transformers and motors; characteristics and requirements of power system loads; power system operation and control; earthing and safety requirements; faults in power system and protection; design of industrial and commercial distribution for mission-critical facilities; reliability analysis, risk assessment, safety and maintainability considerations; power quality and interface issues with renewable and alternative energy sources.",Teo Tee Hui,0,0,0,0,0,0,0,0,1,30.002;30.001,,
Intelligent Robotics,30.119,"This subject provides an overview of robot mechanisms, dynamics, and intelligent controls. Topics include planar and spatial kinematics, and motion planning; mechanism design for manipulators and mobile robots; multi-body dynamics; control design, actuators, and sensors; sensing and perception to enable intelligent behavior; and computer vision. Weekly laboratories provide experience with servo drives, real-time control, task modelling and embedded software. Students will build working robotic systems in a group-based term project.",Tan U-Xuan,0,0,0,0,0,0,0,0,1,30.002;30.101,,
Micro-Nano Projects Laboratory,30.200,"This subject introduces students to key micro-fabrication and nano-engineering techniques that serve as a ?€?toolbox?€? for product design in the micro/nano-technology area. Concepts, ideas and enabling tools of micro/nano-technologies are taught through hands-on intensive lab modules, which include microfluidics, micro and nano-patterning, nanomaterials and molecular scale imaging tools. Students will learn to operate some common instruments in the area of micro/nano-technology (e.g. UV exposure, plasma treatment machine, upright and inverted fluorescence microscope, nanoimprinter, scanning electron microscope), make micro/nano-scale devices and structures, perform experimental observation and improve experimental set-ups. The course is highly interdisciplinary in the development of integrative thinking of fundamental science and engineering knowledge curriculum through building, observing and manipulating objects at the micro and nano-scale. Students will have a broad view on how micro/nano-technologies are being advanced, and their huge impact on biomedical and precise manufacturing applications.",Hong Yee Low; Ye Ai,0,0,0,0,0,0,0,0,1,30.103;30.108,,
Wireless Communications and Internet of Things,30.201,"This course is an introduction to the design and analysis of wireless communications systems and internet-of-things. Students will understand the basic fundamental challenges, and study state-of-the-art technologies, in terms of internet-of-things system architecture, signaling protocol, and wireless communications techniques. Students will build a working cloud-connected wireless internet-of-things smart systems in a group-based lab and project.",Yuen Chau,0,0,0,0,0,0,0,0,1,,,
Design of Intelligent Digital Integrated Circuits and Systems,30.202,"30.202 Design of Intelligent Digital Integrated Circuits and Systems examines the device and circuit level optimization of digital building blocks. Topics covered include: MOS device models including Deep Sub-Micron effects; circuit design styles for logic, arithmetic and sequential blocks; estimation and minimization of energy consumption; interconnect models and parasitic; device sizing and logical effort; timing issues (clock skew and jitter) and active clock distribution techniques; memory architectures, circuits (sense amplifiers) and devices; testing of integrated circuits. The course employs extensive use of circuit layout and SPICE in design projects and software labs.",Teo Tee Hui,0,0,0,0,0,0,0,0,1,30.002;30.101,,
Structural Mechanics and Design,30.207,"This course presents a solid foundation of the fundamentals of structural mechanics, from the macro-level of structural analysis to the molecular level of materials science and engineering. Students will learn and appreciate how structural analysis and materials response are intricately involved in the engineering product/device design process. Fundamental concepts of materials failures (including fracture, fatigue and creep) and their microstructural origins (in important engineering materials including metals, ceramics, polymers and composite ?€? be it structural or elemental) will be introduced in the class, with emphasis on structural design for safety and reliability. In these aspects, the class could be likened to the popular CSI (Crime Scene Investigation) TV series where in every episode, the students will be presented with the ?€?dead bodies in the crime scene?€? (ie. the failed components of an engineering systems/devices) and based on the ?€?forensic knowledge?€?, they will be asked to ?€?solve the case?€? (ie. based on structural mechanics knowledge, the students of this class will solve how the engineering systems/devices fail and how that led to the final catastrophic events that result in the failed parts found in the accident scene). Relevant principles and concepts in several applications ?€? from design of large mechanical structures in civil engineering, to transportation (aerospace, automotive, etc.), to marine as well as high technology often in micro/nano-scale (microelectronics, energy, solar PV, battery, etc.) industries ?€? will be discussed. Throughout the course, emphasis will be placed on the foundations of structural mechanics, relevant design applications in the various fields of industries in Singapore, problem-solving, experimental design, and data analysis.",Arief Suriadi Budiman,0,0,0,0,0,0,0,0,1,30.001;30.108,,
Global Health Technologies,01.101,"Global Health Technologies course provides a multi-disciplinary approach to global health technology design using real world projects and partners. The course explores the current state of global health challenges (with special focus on Singapore and her neighbours), and teaches students how to design medical technologies (e.g. products, systems) that address these problems. The same technology that is applicable in developing countries will be tested in Singapore as a pilot run, before being introduced to the neighboring countries. In their respective project groups, students will brainstorm and define current elderly issues pertaining to community hospitals (e.g. St Andrew?€?s Community Hospital) in Singapore. Guest lectures, panel discussions and organized field trip will allow student to have a first-hand experience to global health issues and help students come up with better solutions. The Biodesign Innovation process will be taught and applied in the student projects.",Dawn Koh,0,0,0,0,0,1,0,1,0,,,
Networked Life,01.104,"Driven by a number of real-world questions about our networked lives, this course explores the technology behind the multi-trillion dollar Internet and wireless industries.
 
 How does Google sell ad space and rank webpages? How does Netflix recommend movies and Amazon rank products? How can you influence people on Facebook and Twitter and can you really reach anyone in six steps? How can you make your video viral on YouTube? Why doesn?€?t the Internet collapse under congestion and does it have an Achilles?€? heel? Why are you charged per gigabyte for mobile data? How does CDMA work in my smartphone? These are some of the networked life issues the course will address in providing answers to the above questions, which are the subject of a fascinating intersection of disciplines, including computer science, physics, sociology, mathematics and economics. Researchers from these areas all strive to quantify and explain the growing complexity and connectivity of the world around us, and they have begun to develop a rich new science along the way to reason about the new social, economic and technological networks.
 
 The course will motivate the student through actual applications to enable both an overview of these systems and a fundamental understanding of the key ideas. It will introduce the various tools and modelling concepts that apply in each situation, targeting at a truly interdisciplinary learning experience.",,0,0,0,0,0,1,0,1,0,,,
Engineering Management,01.106,"Introduction and overview of engineering management. Financial principles, management of innovation, technology strategy, and best management practices. Cases are discussed in class for class participation. Focus is on the development of individual skills and team work, and exposure to management tools.",,0,0,0,0,0,1,0,1,0,,,
Culture Formation and Innovative Product Design,01.111,"This course introduces innovative product design methods and techniques in the crosscultural contexts. In this course, we focus on consumer products (used or consumed by ordinary end users rather than professionals), including physical products and computer software.",Jiang Hao,0,0,0,0,0,1,0,1,0,,,
Energy Systems and Management,01.102,"Broadly, this course aims to acquaint students with both the operation and economics of modern electric power systems. Topics include optimal power flow, unit commitment, economic dispatch, electricity markets, as well as emerging techniques for renewable energy integration and demand response. By the end of the course, students will have developed a firm grasp of optimal power system operations, the emerging challenges facing deep renewable energy integration, tools to effectively tackle said challenges, as well as the energy system and markets in Singapore. ?€?",,0,0,0,0,0,0,0,0,1,,,
Design and Manufacturing,01.105,"This subject provides exposure to a range of current industrial processes and practices used to manufacture products in high and low volumes, with in-depth focus on several selected processes. It gives an integrated perspective of design, engineering, and management disciplines and practices for analysis and design of manufacturing enterprises. Emphasis is on the physics and stochastic nature of manufacturing processes and systems, and their effects on quality, rate, cost, and flexibility. Topics include process physics and control, design for manufacturing, and manufacturing systems. Group project requires design and fabrication of parts using mass-production and assembly methods to produce a product in quantity.",Tan U-Xuan,0,0,0,0,0,0,0,0,1,,,
Probability,40.001,"The course aims at providing the students with the basic tools for modelling and analysing situations that involve uncertainty and will consider applications in various fields. The course will develop a rigorous analysis of finite probability models and provide an introduction to infinite models. The course will cover the following topics: axioms of probability, conditional probability and independence, random variables, random vectors, probability distributions, properties of expectation and limit theorems.",,0,0,1,0,1,0,1,0,0,,,
Optimisation,40.002,"The course covers a broad range of optimisation algorithms and models. The course will cover the following topics: linear programming, simplex algorithm, duality, sensitivity analysis, two player zero-sum games, network optimisation, minimum cost flow, network simplex algorithm, integer programming, branch and bound methods, cutting plane methods, dynamic programming. Throughout the course, a number of applications from various areas will be discussed.",,0,0,1,0,1,0,1,0,0,,,
